{
  "bounds": {
    "min_x": -900.0,
    "min_y": -900.0,
    "max_x": 900.0,
    "max_y": 900.0
  },
  "center": {
    "lat": 41.8827,
    "lon": -87.6233
  },
  "buildings": [
    {
      "id": "w1000",
      "ring": [
        [
          -745.0,
          -660.0
        ],
        [
          -655.0,
          -660.0
        ],
        [
          -655.0,
          -540.0
        ],
        [
          -745.0,
          -540.0
        ]
      ],
      "holes": [],
      "height_m": 8.0,
      "height_source": "tag",
      "min_height_m": 0.0,
      "is_tall": false
    },
    {
      "id": "w1001",
      "ring": [
        [
          -545.0,
          -660.0
        ],
        [
          -455.0,
          -660.0
        ],
        [
          -455.0,
          -540.0
        ],
        [
          -545.0,
          -540.0
        ]
      ],
      "holes": [],
      "height_m": 12.0,
      "height_source": "levels",
      "min_height_m": 0.0,
      "is_tall": false
    },
    {
      "id": "w1002",
      "ring": [
        [
          -345.0,
          -660.0
        ],
        [
          -255.0,
          -660.0
        ],
        [
          -255.0,
          -540.0
        ],
        [
          -345.0,
          -540.0
        ]
      ],
      "holes": [],
      "height_m": 15.0,
      "height_source": "default",
      "min_height_m": 0.0,
      "is_tall": false
    },
    {
      "id": "w1003",
      "ring": [
        [
          -145.0,
          -660.0
        ],
        [
          -55.0,
          -660.0
        ],
        [
          -55.0,
          -540.0
        ],
        [
          -145.0,
          -540.0
        ]
      ],
      "holes": [],
      "height_m": 18.0,
      "height_source": "tag",
      "min_height_m": 0.0,
      "is_tall": false
    },
    {
      "id": "w1004",
      "ring": [
        [
          55.0,
          -660.0
        ],
        [
          145.0,
          -660.0
        ],
        [
          145.0,
          -540.0
        ],
        [
          55.0,
          -540.0
        ]
      ],
      "holes": [],
      "height_m": 22.0,
      "height_source": "levels",
      "min_height_m": 0.0,
      "is_tall": false
    },
    {
      "id": "w1005",
      "ring": [
        [
          255.0,
          -660.0
        ],
        [
          345.0,
          -660.0
        ],
        [
          345.0,
          -540.0
        ],
        [
          255.0,
          -540.0
        ]
      ],
      "holes": [],
      "height_m": 25.0,
      "height_source": "default",
      "min_height_m": 0.0,
      "is_tall": false
    },
    {
      "id": "w1006",
      "ring": [
        [
          455.0,
          -660.0
        ],
        [
          545.0,
          -660.0
        ],
        [
          545.0,
          -540.0
        ],
        [
          455.0,
          -540.0
        ]
      ],
      "holes": [],
      "height_m": 28.0,
      "height_source": "tag",
      "min_height_m": 0.0,
      "is_tall": false
    },
    {
      "id": "w1007",
      "ring": [
        [
          655.0,
          -660.0
        ],
        [
          745.0,
          -660.0
        ],
        [
          745.0,
          -540.0
        ],
        [
          655.0,
          -540.0
        ]
      ],
      "holes": [],
      "height_m": 32.0,
      "height_source": "levels",
      "min_height_m": 0.0,
      "is_tall": false
    },
    {
      "id": "w1008",
      "ring": [
        [
          -750.0,
          -365.0
        ],
        [
          -650.0,
          -365.0
        ],
        [
          -650.0,
          -235.0
        ],
        [
          -750.0,
          -235.0
        ]
      ],
      "holes": [],
      "height_m": 20.0,
      "height_source": "default",
      "min_height_m": 0.0,
      "is_tall": false
    },
    {
      "id": "w1009",
      "ring": [
        [
          -550.0,
          -365.0
        ],
        [
          -450.0,
          -365.0
        ],
        [
          -450.0,
          -235.0
        ],
        [
          -550.0,
          -235.0
        ]
      ],
      "holes": [],
      "height_m": 35.0,
      "height_source": "tag",
      "min_height_m": 0.0,
      "is_tall": false
    },
    {
      "id": "w1010",
      "ring": [
        [
          -350.0,
          -365.0
        ],
        [
          -250.0,
          -365.0
        ],
        [
          -250.0,
          -235.0
        ],
        [
          -350.0,
          -235.0
        ]
      ],
      "holes": [],
      "height_m": 45.0,
      "height_source": "levels",
      "min_height_m": 0.0,
      "is_tall": true
    },
    {
      "id": "w1011",
      "ring": [
        [
          -150.0,
          -365.0
        ],
        [
          -50.0,
          -365.0
        ],
        [
          -50.0,
          -235.0
        ],
        [
          -150.0,
          -235.0
        ]
      ],
      "holes": [],
      "height_m": 55.0,
      "height_source": "default",
      "min_height_m": 0.0,
      "is_tall": true
    },
    {
      "id": "w1012",
      "ring": [
        [
          50.0,
          -365.0
        ],
        [
          150.0,
          -365.0
        ],
        [
          150.0,
          -235.0
        ],
        [
          50.0,
          -235.0
        ]
      ],
      "holes": [],
      "height_m": 42.0,
      "height_source": "tag",
      "min_height_m": 0.0,
      "is_tall": true
    },
    {
      "id": "w1013",
      "ring": [
        [
          250.0,
          -365.0
        ],
        [
          350.0,
          -365.0
        ],
        [
          350.0,
          -235.0
        ],
        [
          250.0,
          -235.0
        ]
      ],
      "holes": [],
      "height_m": 38.0,
      "height_source": "levels",
      "min_height_m": 0.0,
      "is_tall": false
    },
    {
      "id": "w1014",
      "ring": [
        [
          450.0,
          -365.0
        ],
        [
          550.0,
          -365.0
        ],
        [
          550.0,
          -235.0
        ],
        [
          450.0,
          -235.0
        ]
      ],
      "holes": [],
      "height_m": 60.0,
      "height_source": "default",
      "min_height_m": 0.0,
      "is_tall": true
    },
    {
      "id": "w1015",
      "ring": [
        [
          650.0,
          -365.0
        ],
        [
          750.0,
          -365.0
        ],
        [
          750.0,
          -235.0
        ],
        [
          650.0,
          -235.0
        ]
      ],
      "holes": [],
      "height_m": 48.0,
      "height_source": "tag",
      "min_height_m": 0.0,
      "is_tall": true
    },
    {
      "id": "w1016",
      "ring": [
        [
          -755.0,
          -70.0
        ],
        [
          -645.0,
          -70.0
        ],
        [
          -645.0,
          70.0
        ],
        [
          -755.0,
          70.0
        ]
      ],
      "holes": [],
      "height_m": 95.0,
      "height_source": "levels",
      "min_height_m": 0.0,
      "is_tall": true
    },
    {
      "id": "w1017",
      "ring": [
        [
          -555.0,
          -70.0
        ],
        [
          -445.0,
          -70.0
        ],
        [
          -445.0,
          70.0
        ],
        [
          -555.0,
          70.0
        ]
      ],
      "holes": [],
      "height_m": 140.0,
      "height_source": "default",
      "min_height_m": 0.0,
      "is_tall": true
    },
    {
      "id": "w1018",
      "ring": [
        [
          -355.0,
          -70.0
        ],
        [
          -245.0,
          -70.0
        ],
        [
          -245.0,
          70.0
        ],
        [
          -355.0,
          70.0
        ]
      ],
      "holes": [],
      "height_m": 180.0,
      "height_source": "tag",
      "min_height_m": 0.0,
      "is_tall": true
    },
    {
      "id": "w1019",
      "ring": [
        [
          -155.0,
          -70.0
        ],
        [
          -45.0,
          -70.0
        ],
        [
          -45.0,
          70.0
        ],
        [
          -155.0,
          70.0
        ]
      ],
      "holes": [
        [
          [
            -127.5,
            -35.0
          ],
          [
            -127.5,
            35.0
          ],
          [
            -72.5,
            35.0
          ],
          [
            -72.5,
            -35.0
          ]
        ]
      ],
      "height_m": 300.0,
      "height_source": "levels",
      "min_height_m": 0.0,
      "is_tall": true
    },
    {
      "id": "w1020",
      "ring": [
        [
          45.0,
          -70.0
        ],
        [
          155.0,
          -70.0
        ],
        [
          155.0,
          70.0
        ],
        [
          45.0,
          70.0
        ]
      ],
      "holes": [],
      "height_m": 220.0,
      "height_source": "default",
      "min_height_m": 0.0,
      "is_tall": true
    },
    {
      "id": "w1021",
      "ring": [
        [
          245.0,
          -70.0
        ],
        [
          355.0,
          -70.0
        ],
        [
          355.0,
          70.0
        ],
        [
          245.0,
          70.0
        ]
      ],
      "holes": [],
      "height_m": 160.0,
      "height_source": "tag",
      "min_height_m": 0.0,
      "is_tall": true
    },
    {
      "id": "w1022",
      "ring": [
        [
          445.0,
          -70.0
        ],
        [
          555.0,
          -70.0
        ],
        [
          555.0,
          70.0
        ],
        [
          445.0,
          70.0
        ]
      ],
      "holes": [],
      "height_m": 110.0,
      "height_source": "levels",
      "min_height_m": 0.0,
      "is_tall": true
    },
    {
      "id": "w1023",
      "ring": [
        [
          645.0,
          -70.0
        ],
        [
          755.0,
          -70.0
        ],
        [
          755.0,
          70.0
        ],
        [
          645.0,
          70.0
        ]
      ],
      "holes": [],